10:57:03.831190 IP 192.168.1.107.40178 > 192.168.1.105.ssh: Flags [S], seq 3306934327, win 29200, options [mss 1460,sackOK,TS val 205144 ecr 0,nop,wscale 6], length 0
10:57:03.831428 IP 192.168.1.107.40178 > 192.168.1.105.ssh: Flags [.], ack 1611595971, win 457, options [nop,nop,TS val 205144 ecr 4294932538], length 0
10:57:03.831632 IP 192.168.1.107.40178 > 192.168.1.105.ssh: Flags [P.], seq 0:39, ack 1, win 457, options [nop,nop,TS val 205144 ecr 4294932538], length 39
10:57:03.840476 IP 192.168.1.107.40178 > 192.168.1.105.ssh: Flags [.], ack 40, win 457, options [nop,nop,TS val 205146 ecr 4294932540], length 0
10:57:03.840828 IP 192.168.1.107.40178 > 192.168.1.105.ssh: Flags [.], ack 992, win 486, options [nop,nop,TS val 205146 ecr 4294932540], length 0
10:57:03.841640 IP 192.168.1.107.40178 > 192.168.1.105.ssh: Flags [P.], seq 39:2007, ack 992, win 486, options [nop,nop,TS val 205147 ecr 4294932540], length 1968
10:57:03.843669 IP 192.168.1.107.40178 > 192.168.1.105.ssh: Flags [P.], seq 2007:2055, ack 992, win 486, options [nop,nop,TS val 205147 ecr 4294932540], length 48
10:57:03.856331 IP 192.168.1.107.40178 > 192.168.1.105.ssh: Flags [P.], seq 2055:2071, ack 1272, win 516, options [nop,nop,TS val 205150 ecr 4294932543], length 16
10:57:03.894564 IP 192.168.1.107.40178 > 192.168.1.105.ssh: Flags [P.], seq 2071:2115, ack 1272, win 516, options [nop,nop,TS val 205160 ecr 4294932554], length 44
10:57:03.894968 IP 192.168.1.107.40178 > 192.168.1.105.ssh: Flags [P.], seq 2115:2175, ack 1316, win 516, options [nop,nop,TS val 205160 ecr 4294932554], length 60
10:57:03.989330 IP 192.168.1.107.40178 > 192.168.1.105.ssh: Flags [.], ack 1360, win 516, options [nop,nop,TS val 205184 ecr 4294932567], length 0
10:57:13.548804 IP 192.168.1.107.40178 > 192.168.1.105.ssh: Flags [P.], seq 2175:2315, ack 1360, win 516, options [nop,nop,TS val 207576 ecr 4294932567], length 140
10:57:15.443389 IP 192.168.1.107.40178 > 192.168.1.105.ssh: Flags [.], ack 1404, win 516, options [nop,nop,TS val 208050 ecr 4294935441], length 0
10:57:20.090197 IP 192.168.1.107.40178 > 192.168.1.105.ssh: Flags [P.], seq 2315:2455, ack 1404, win 516, options [nop,nop,TS val 209213 ecr 4294935441], length 140
10:57:20.111669 IP 192.168.1.107.40178 > 192.168.1.105.ssh: Flags [.], ack 1432, win 516, options [nop,nop,TS val 209218 ecr 4294936608], length 0
10:57:20.111784 IP 192.168.1.107.40178 > 192.168.1.105.ssh: Flags [P.], seq 2455:2559, ack 1432, win 516, options [nop,nop,TS val 209218 ecr 4294936608], length 104
10:57:20.118577 IP 192.168.1.107.40178 > 192.168.1.105.ssh: Flags [P.], seq 2559:2995, ack 1476, win 516, options [nop,nop,TS val 209220 ecr 4294936610], length 436
10:57:20.120006 IP 192.168.1.107.40178 > 192.168.1.105.ssh: Flags [.], ack 1676, win 516, options [nop,nop,TS val 209220 ecr 4294936610], length 0
10:57:20.121057 IP 192.168.1.107.40178 > 192.168.1.105.ssh: Flags [.], ack 2348, win 546, options [nop,nop,TS val 209221 ecr 4294936610], length 0
10:57:20.205343 IP 192.168.1.107.40178 > 192.168.1.105.ssh: Flags [.], ack 2392, win 546, options [nop,nop,TS val 209242 ecr 4294936622], length 0
10:57:23.954450 IP 192.168.1.107.40178 > 192.168.1.105.ssh: Flags [P.], seq 2995:3023, ack 2392, win 546, options [nop,nop,TS val 210180 ecr 4294936622], length 28
10:57:23.954965 IP 192.168.1.107.40178 > 192.168.1.105.ssh: Flags [.], ack 2420, win 546, options [nop,nop,TS val 210180 ecr 4294937569], length 0
10:57:23.955064 IP 192.168.1.107.40178 > 192.168.1.105.ssh: Flags [.], ack 2448, win 546, options [nop,nop,TS val 210180 ecr 4294937569], length 0
10:57:23.955067 IP 192.168.1.107.40178 > 192.168.1.105.ssh: Flags [.], ack 2492, win 546, options [nop,nop,TS val 210180 ecr 4294937569], length 0
10:57:26.452955 IP 192.168.1.107.40178 > 192.168.1.105.ssh: Flags [P.], seq 3023:3051, ack 2492, win 546, options [nop,nop,TS val 210805 ecr 4294937569], length 28
10:57:26.453345 IP 192.168.1.107.40178 > 192.168.1.105.ssh: Flags [.], ack 2520, win 546, options [nop,nop,TS val 210805 ecr 4294938193], length 0
10:57:26.712472 IP 192.168.1.107.40178 > 192.168.1.105.ssh: Flags [P.], seq 3051:3079, ack 2520, win 546, options [nop,nop,TS val 210870 ecr 4294938193], length 28
10:57:26.712825 IP 192.168.1.107.40178 > 192.168.1.105.ssh: Flags [.], ack 2548, win 546, options [nop,nop,TS val 210870 ecr 4294938258], length 0
10:57:26.874679 IP 192.168.1.107.40178 > 192.168.1.105.ssh: Flags [P.], seq 3079:3107, ack 2548, win 546, options [nop,nop,TS val 210911 ecr 4294938258], length 28
10:57:26.875092 IP 192.168.1.107.40178 > 192.168.1.105.ssh: Flags [.], ack 2576, win 546, options [nop,nop,TS val 210911 ecr 4294938299], length 0
10:57:27.012574 IP 192.168.1.107.40178 > 192.168.1.105.ssh: Flags [P.], seq 3107:3135, ack 2576, win 546, options [nop,nop,TS val 210945 ecr 4294938299], length 28
10:57:27.012986 IP 192.168.1.107.40178 > 192.168.1.105.ssh: Flags [.], ack 2604, win 546, options [nop,nop,TS val 210945 ecr 4294938333], length 0
10:57:27.159948 IP 192.168.1.107.40178 > 192.168.1.105.ssh: Flags [P.], seq 3135:3163, ack 2604, win 546, options [nop,nop,TS val 210982 ecr 4294938333], length 28
10:57:27.160538 IP 192.168.1.107.40178 > 192.168.1.105.ssh: Flags [.], ack 2632, win 546, options [nop,nop,TS val 210982 ecr 4294938370], length 0
10:57:27.160544 IP 192.168.1.107.40178 > 192.168.1.105.ssh: Flags [.], ack 2676, win 546, options [nop,nop,TS val 210982 ecr 4294938370], length 0
10:57:27.160545 IP 192.168.1.107.40178 > 192.168.1.105.ssh: Flags [.], ack 2704, win 546, options [nop,nop,TS val 210982 ecr 4294938370], length 0
10:57:27.166763 IP 192.168.1.107.40178 > 192.168.1.105.ssh: Flags [.], ack 2848, win 576, options [nop,nop,TS val 210984 ecr 4294938372], length 0
10:57:27.166872 IP 192.168.1.107.40178 > 192.168.1.105.ssh: Flags [P.], seq 3163:3191, ack 2848, win 576, options [nop,nop,TS val 210984 ecr 4294938372], length 28
10:57:27.167018 IP 192.168.1.107.40178 > 192.168.1.105.ssh: Flags [P.], seq 3191:3251, ack 2848, win 576, options [nop,nop,TS val 210984 ecr 4294938372], length 60
10:57:27.168095 IP 192.168.1.107.40178 > 192.168.1.105.ssh: Flags [F.], seq 3251, ack 2848, win 576, options [nop,nop,TS val 210984 ecr 4294938372], length 0
10:57:27.168119 IP 192.168.1.107.40178 > 192.168.1.105.ssh: Flags [.], ack 2849, win 576, options [nop,nop,TS val 210984 ecr 4294938372], length 0

